[
  {
    "category": "dungeon_event",
    "id": "event_chronal_altar",
    "schema_version": 1,
    "name_key": "EVENT_CHRONAL_ALTAR_NAME",
    "description_key": "EVENT_CHRONAL_ALTAR_DESC",
    "prompt_key": "EVENT_CHRONAL_ALTAR_PROMPT",
    "availability": [
      "LAUNCH",
      "EXPANSION"
    ],
    "special": false,
    "floor_min": 1,
    "floor_max": 5,
    "weight": 10,
    "repeat_policy": "once_per_run",
    "trigger_predicate_id": "always",
    "outcome_channel": "event_outcome_v1",
    "options": [
      {
        "id": "commit",
        "label_key": "EVENT_CHRONAL_ALTAR_OPTION_COMMIT",
        "outcome_key": "EVENT_CHRONAL_ALTAR_OUTCOME_COMMIT",
        "outcome_visibility": "preview_category",
        "requirements": [
          {
            "operation": "floor_index_min",
            "arguments": {
              "value": 1
            }
          }
        ],
        "consequences": [
          {
            "operation": "temporary_modifier",
            "arguments": {
              "modifier_id": "chronal_grace",
              "room_count": 3
            }
          }
        ]
      },
      {
        "id": "decline",
        "label_key": "EVENT_CHRONAL_ALTAR_OPTION_DECLINE",
        "outcome_key": "EVENT_CHRONAL_ALTAR_OUTCOME_DECLINE",
        "outcome_visibility": "preview_exact",
        "requirements": [
          {
            "operation": "floor_index_min",
            "arguments": {
              "value": 1
            }
          }
        ],
        "consequences": [
          {
            "operation": "narrative_flag",
            "arguments": {
              "flag": "declined_chronal_altar",
              "value": true
            }
          }
        ]
      }
    ]
  },
  {
    "category": "dungeon_event",
    "id": "event_trapped_traveler",
    "schema_version": 1,
    "name_key": "EVENT_TRAPPED_TRAVELER_NAME",
    "description_key": "EVENT_TRAPPED_TRAVELER_DESC",
    "prompt_key": "EVENT_TRAPPED_TRAVELER_PROMPT",
    "availability": [
      "LAUNCH",
      "EXPANSION"
    ],
    "special": false,
    "floor_min": 1,
    "floor_max": 4,
    "weight": 10,
    "repeat_policy": "once_per_run",
    "trigger_predicate_id": "always",
    "outcome_channel": "event_outcome_v1",
    "options": [
      {
        "id": "commit",
        "label_key": "EVENT_TRAPPED_TRAVELER_OPTION_COMMIT",
        "outcome_key": "EVENT_TRAPPED_TRAVELER_OUTCOME_COMMIT",
        "outcome_visibility": "preview_category",
        "requirements": [
          {
            "operation": "floor_index_min",
            "arguments": {
              "value": 1
            }
          }
        ],
        "consequences": [
          {
            "operation": "reward_draft",
            "arguments": {
              "pool": "blessing",
              "choices": 2
            }
          }
        ]
      },
      {
        "id": "decline",
        "label_key": "EVENT_TRAPPED_TRAVELER_OPTION_DECLINE",
        "outcome_key": "EVENT_TRAPPED_TRAVELER_OUTCOME_DECLINE",
        "outcome_visibility": "preview_exact",
        "requirements": [
          {
            "operation": "floor_index_min",
            "arguments": {
              "value": 1
            }
          }
        ],
        "consequences": [
          {
            "operation": "narrative_flag",
            "arguments": {
              "flag": "declined_trapped_traveler",
              "value": true
            }
          }
        ]
      }
    ]
  },
  {
    "category": "dungeon_event",
    "id": "event_cursed_pool",
    "schema_version": 1,
    "name_key": "EVENT_CURSED_POOL_NAME",
    "description_key": "EVENT_CURSED_POOL_DESC",
    "prompt_key": "EVENT_CURSED_POOL_PROMPT",
    "availability": [
      "LAUNCH",
      "EXPANSION"
    ],
    "special": false,
    "floor_min": 1,
    "floor_max": 5,
    "weight": 8,
    "repeat_policy": "once_per_run",
    "trigger_predicate_id": "no_curse",
    "outcome_channel": "event_outcome_v1",
    "options": [
      {
        "id": "commit",
        "label_key": "EVENT_CURSED_POOL_OPTION_COMMIT",
        "outcome_key": "EVENT_CURSED_POOL_OUTCOME_COMMIT",
        "outcome_visibility": "preview_category",
        "requirements": [
          {
            "operation": "floor_index_min",
            "arguments": {
              "value": 1
            }
          }
        ],
        "consequences": [
          {
            "operation": "curse_add",
            "arguments": {
              "curse_id": "curse_pool_mark"
            }
          }
        ]
      },
      {
        "id": "decline",
        "label_key": "EVENT_CURSED_POOL_OPTION_DECLINE",
        "outcome_key": "EVENT_CURSED_POOL_OUTCOME_DECLINE",
        "outcome_visibility": "preview_exact",
        "requirements": [
          {
            "operation": "floor_index_min",
            "arguments": {
              "value": 1
            }
          }
        ],
        "consequences": [
          {
            "operation": "narrative_flag",
            "arguments": {
              "flag": "declined_cursed_pool",
              "value": true
            }
          }
        ]
      }
    ]
  },
  {
    "category": "dungeon_event",
    "id": "event_smiths_legacy",
    "schema_version": 1,
    "name_key": "EVENT_SMITHS_LEGACY_NAME",
    "description_key": "EVENT_SMITHS_LEGACY_DESC",
    "prompt_key": "EVENT_SMITHS_LEGACY_PROMPT",
    "availability": [
      "LAUNCH",
      "EXPANSION"
    ],
    "special": false,
    "floor_min": 1,
    "floor_max": 5,
    "weight": 9,
    "repeat_policy": "once_per_run",
    "trigger_predicate_id": "always",
    "outcome_channel": "event_outcome_v1",
    "options": [
      {
        "id": "commit",
        "label_key": "EVENT_SMITHS_LEGACY_OPTION_COMMIT",
        "outcome_key": "EVENT_SMITHS_LEGACY_OUTCOME_COMMIT",
        "outcome_visibility": "preview_category",
        "requirements": [
          {
            "operation": "floor_index_min",
            "arguments": {
              "value": 1
            }
          }
        ],
        "consequences": [
          {
            "operation": "temporary_modifier",
            "arguments": {
              "modifier_id": "weapon_temper",
              "room_count": 3
            }
          }
        ]
      },
      {
        "id": "decline",
        "label_key": "EVENT_SMITHS_LEGACY_OPTION_DECLINE",
        "outcome_key": "EVENT_SMITHS_LEGACY_OUTCOME_DECLINE",
        "outcome_visibility": "preview_exact",
        "requirements": [
          {
            "operation": "floor_index_min",
            "arguments": {
              "value": 1
            }
          }
        ],
        "consequences": [
          {
            "operation": "narrative_flag",
            "arguments": {
              "flag": "declined_smiths_legacy",
              "value": true
            }
          }
        ]
      }
    ]
  },
  {
    "category": "dungeon_event",
    "id": "event_memory_mirror",
    "schema_version": 1,
    "name_key": "EVENT_MEMORY_MIRROR_NAME",
    "description_key": "EVENT_MEMORY_MIRROR_DESC",
    "prompt_key": "EVENT_MEMORY_MIRROR_PROMPT",
    "availability": [
      "LAUNCH",
      "EXPANSION"
    ],
    "special": false,
    "floor_min": 2,
    "floor_max": 5,
    "weight": 8,
    "repeat_policy": "once_per_run",
    "trigger_predicate_id": "always",
    "outcome_channel": "event_outcome_v1",
    "options": [
      {
        "id": "commit",
        "label_key": "EVENT_MEMORY_MIRROR_OPTION_COMMIT",
        "outcome_key": "EVENT_MEMORY_MIRROR_OUTCOME_COMMIT",
        "outcome_visibility": "preview_category",
        "requirements": [
          {
            "operation": "floor_index_min",
            "arguments": {
              "value": 2
            }
          }
        ],
        "consequences": [
          {
            "operation": "temporary_modifier",
            "arguments": {
              "modifier_id": "past_strength",
              "attack_count": 3
            }
          }
        ]
      },
      {
        "id": "decline",
        "label_key": "EVENT_MEMORY_MIRROR_OPTION_DECLINE",
        "outcome_key": "EVENT_MEMORY_MIRROR_OUTCOME_DECLINE",
        "outcome_visibility": "preview_exact",
        "requirements": [
          {
            "operation": "floor_index_min",
            "arguments": {
              "value": 2
            }
          }
        ],
        "consequences": [
          {
            "operation": "narrative_flag",
            "arguments": {
              "flag": "declined_memory_mirror",
              "value": true
            }
          }
        ]
      }
    ]
  },
  {
    "category": "dungeon_event",
    "id": "event_planar_merchant",
    "schema_version": 1,
    "name_key": "EVENT_PLANAR_MERCHANT_NAME",
    "description_key": "EVENT_PLANAR_MERCHANT_DESC",
    "prompt_key": "EVENT_PLANAR_MERCHANT_PROMPT",
    "availability": [
      "LAUNCH",
      "EXPANSION"
    ],
    "special": false,
    "floor_min": 2,
    "floor_max": 5,
    "weight": 8,
    "repeat_policy": "once_per_floor",
    "trigger_predicate_id": "rich",
    "outcome_channel": "event_outcome_v1",
    "options": [
      {
        "id": "commit",
        "label_key": "EVENT_PLANAR_MERCHANT_OPTION_COMMIT",
        "outcome_key": "EVENT_PLANAR_MERCHANT_OUTCOME_COMMIT",
        "outcome_visibility": "preview_category",
        "requirements": [
          {
            "operation": "floor_index_min",
            "arguments": {
              "value": 2
            }
          }
        ],
        "consequences": [
          {
            "operation": "resource_delta",
            "arguments": {
              "resource": "gold",
              "amount": -80
            }
          },
          {
            "operation": "reward_draft",
            "arguments": {
              "pool": "item",
              "choices": 3
            }
          }
        ]
      },
      {
        "id": "decline",
        "label_key": "EVENT_PLANAR_MERCHANT_OPTION_DECLINE",